{
  "protocolVersion": 2,
  "capabilities": ["formation.line", "formation.v", "formation.sweep", "movement.linear", "movement.sine", "movement.stationary", "pattern.radial", "pattern.aimed", "pattern.fan", "pattern.spiral", "pattern.rain", "shot.parallel", "shot.fan", "bomb.clear-and-damage", "bomb.clear-only"],
  "game": {
    "id": "starfall-barrage",
    "title": "STARFALL BARRAGE",
    "subtitle": "두 개의 짧은 스테이지로 구성된 데이터 기반 탄막 슈팅 프로토타입",
    "version": "0.7.1",
    "defaultPlayer": "star_traveler",
    "entryStage": "moonlit_path"
  },
  "rules": {
    "playfield": { "width": 640, "height": 720 },
    "pools": { "playerShots": 180, "enemyBullets": 900, "enemies": 80, "pickups": 50 },
    "playerHitboxRadius": 12,
    "grazeRadius": 34,
    "hitInvulnerabilityMs": 2200,
    "deathPowerLoss": 1,
    "respawnBombs": 2,
    "bulletCullMargin": 60,
    "pickupFallSpeed": 85
  },
  "scoring": {
    "grazeBase": 100,
    "pickup": 2500,
    "bombBulletClear": 40,
    "bossCapture": 50000,
    "bossTimeout": 10000,
    "bossTimeMultiplier": 8,
    "clearPerLife": 30000,
    "clearPerBomb": 10000
  },
  "ui": {
    "eyebrow": "DATA-DRIVEN BULLET HELL",
    "brandKicker": "THE FIRST SPELL",
    "brandTitle": "星降る\n弾幕",
    "brandCaption": "STARFALL BARRAGE",
    "pauseButton": "P · 일시정지",
    "pauseTitle": "PAUSED",
    "pauseHelp": "P 또는 버튼으로 계속",
    "loading": "탄막 패턴을 전개하는 중",
    "stageProgress": "STAGE {current} / {total}",
    "guideTitle": "조작",
    "guide": [
      { "label": "이동", "value": "방향키 / WASD" },
      { "label": "사격", "value": "Z 누르고 있기" },
      { "label": "저속·히트박스", "value": "Shift" },
      { "label": "폭탄", "value": "X" },
      { "label": "일시정지", "value": "P" }
    ],
    "guideTip": "탄환에 가까이 접근하면 그레이즈 점수와 체인이 상승합니다.",
    "labels": { "highScore": "HI-SCORE", "score": "SCORE", "player": "PLAYER", "bomb": "BOMB", "power": "POWER", "graze": "GRAZE", "chain": "CHAIN" },
    "mobile": { "focus": "저속", "shot": "SHOT", "bomb": "BOMB" },
    "stageClear": "STAGE CLEAR",
    "stageClearTitle": "별의 문이 열렸습니다",
    "gameOver": "GAME OVER",
    "gameOverTitle": "탄막에 삼켜졌습니다",
    "retry": "다시 도전",
    "nextDialogue": "다음 ›",
    "startBattle": "계속 ›",
    "dialogueHint": "Z · Space · Enter · 클릭",
    "dialogue": { "showProgress": false },
    "retryHint": "점수를 확인한 뒤 아래 버튼을 선택하세요",
    "title": {
      "kicker": "PROTOCOL DEMONSTRATION",
      "heading": "별의 문에 도전할 여행자를 선택하세요",
      "description": "캐릭터와 조작법을 확인한 뒤 두 개의 짧은 스테이지에 도전합니다.",
      "selectCharacter": "CHARACTER SELECT",
      "controls": "KEY GUIDE",
      "leaderboard": "LOCAL SCOREBOARD",
      "noScores": "아직 기록이 없습니다.",
      "start": "게임 시작",
      "quickRetry": "같은 캐릭터로 재도전",
      "returnToTitle": "타이틀로 돌아가기",
      "clearScores": "기록 초기화"
    },
    "messages": {
      "miss": "MISS",
      "respawn": "남은 기체로 복귀합니다",
      "lastLife": "모든 기체를 잃었습니다",
      "bomb": "STAR BREAK",
      "bombCleared": "탄환 {count}개 소거",
      "bossWarning": "WARNING · 별을 삼키는 수호자"
    }
  },
  "stages": [
    {
      "id": "moonlit_path",
      "name": "STAGE 1 · 달빛 초원",
      "subtitle": "별의 유적으로 향하는 밤길",
      "background": "meadow_background",
      "width": 640,
      "height": 720,
      "introDialogue": "opening",
      "clearDialogue": "stage_one_clear",
      "nextStage": "starfall_ruins",
      "waves": [
        { "atMs": 500, "enemy": "wisp", "count": 5, "formation": { "type": "v", "spacing": 82 } },
        { "atMs": 3500, "enemy": "fairy", "count": 6, "formation": { "type": "sweep", "direction": "left", "spacing": 92 } },
        { "atMs": 7000, "enemy": "wisp", "count": 7, "formation": { "type": "line", "spacing": 76 } }
      ]
    },
    {
      "id": "starfall_ruins",
      "name": "STAGE 2 · 별빛 유적",
      "subtitle": "성좌의 파수꾼이 기다리는 봉인 구역",
      "background": "ruins_background",
      "width": 640,
      "height": 720,
      "introDialogue": "ruins_arrival",
      "bossDialogue": "boss_encounter",
      "clearDialogue": "ending",
      "bossId": "selene",
      "waves": [
        { "atMs": 500, "enemy": "fairy", "count": 5, "formation": { "type": "sweep", "direction": "right", "spacing": 100 } },
        { "atMs": 4300, "enemy": "sentinel", "count": 3, "formation": { "type": "v", "spacing": 150 } }
      ]
    }
  ],
  "dialogues": {
    "opening": [
      { "speaker": "여행자", "text": "저 너머에서 별빛이 흔들리고 있어. 봉인이 무너지기 전에 유적으로 가야 해.", "portrait": "hero_portrait", "side": "left" },
      { "speaker": "???", "text": "돌아가라. 오늘 밤의 유적은 누구도 들이지 않는다.", "side": "right" },
      { "speaker": "여행자", "text": "목소리의 주인을 만나려면, 이 탄막부터 돌파해야겠네.", "portrait": "hero_portrait", "side": "left" }
    ],
    "stage_one_clear": [
      { "speaker": "여행자", "text": "초원의 요정들은 물러났어. 별빛의 근원은 바로 앞이야.", "portrait": "hero_portrait", "side": "left" }
    ],
    "ruins_arrival": [
      { "speaker": "여행자", "text": "여기가 별빛 유적… 공기 속에 탄막의 술식이 가득해.", "portrait": "hero_portrait", "side": "left" },
      { "speaker": "???", "text": "마지막 경고다. 수호자의 영역에서 떠나라.", "side": "right" }
    ],
    "boss_encounter": [
      { "speaker": "셀레네", "text": "나는 성좌의 파수꾼 셀레네. 별의 문을 탐하는 자를 시험한다.", "portrait": "boss_portrait", "side": "right" },
      { "speaker": "여행자", "text": "문을 훔치러 온 게 아니야. 폭주하는 별빛을 멈추러 왔어.", "portrait": "hero_portrait", "side": "left" },
      { "speaker": "셀레네", "text": "그 말이 진실이라면 네 탄막으로 증명해라. 간다—성부 「쌍성의 윤무」!", "portrait": "boss_portrait", "side": "right" }
    ],
    "ending": [
      { "speaker": "셀레네", "text": "훌륭하다. 네 빛이라면 별의 문을 맡길 수 있겠군.", "portrait": "boss_portrait", "side": "right" },
      { "speaker": "여행자", "text": "이제 시작이야. 문 너머에서 무엇이 기다리는지 확인하러 가자.", "portrait": "hero_portrait", "side": "left" }
    ]
  },
  "players": {
    "star_traveler": {
      "name": "별의 여행자",
      "description": "넓은 전방 사격과 안정적인 이동 속도를 가진 균형형 캐릭터",
      "portrait": "hero_portrait",
      "texture": "hero",
      "speed": 310,
      "focusSpeed": 145,
      "lives": 3,
      "bombs": 3,
      "shotIntervalMs": 88,
      "shotSpeed": 720,
      "spawnX": 320,
      "spawnBottom": 82,
      "maxPower": 4,
      "shotName": "별빛 확산탄",
      "bombName": "STAR BREAK",
      "shotLevels": [
        { "power": 1, "type": "parallel", "offsets": [-7, 7], "damage": 2, "velocityXScale": 0 },
        { "power": 2, "type": "parallel", "offsets": [-12, 0, 12], "damage": 2, "velocityXScale": 0 },
        { "power": 3, "type": "parallel", "offsets": [-20, -7, 7, 20], "damage": 2, "velocityXScale": 0 },
        { "power": 4, "type": "fan", "count": 5, "spread": 0.045, "damage": 3 }
      ],
      "bomb": { "type": "clear-and-damage", "damage": 90, "invulnerabilityMs": 1800 }
    },
    "moon_guardian": {
      "name": "달의 수호자",
      "description": "넓은 부채꼴 사격과 방어적인 탄환 소거 폭탄을 사용하는 기체입니다.",
      "portrait": "hero_portrait",
      "texture": "hero",
      "speed": 285,
      "focusSpeed": 125,
      "lives": 4,
      "bombs": 2,
      "shotIntervalMs": 105,
      "shotSpeed": 680,
      "spawnX": 320,
      "spawnBottom": 82,
      "maxPower": 4,
      "shotName": "월광 부채",
      "bombName": "MOON SHIELD",
      "shotLevels": [
        { "power": 1, "type": "parallel", "offsets": [-8, 8], "damage": 2 },
        { "power": 2, "type": "fan", "count": 3, "spread": 0.035, "damage": 2 },
        { "power": 3, "type": "fan", "count": 5, "spread": 0.05, "damage": 2 },
        { "power": 4, "type": "fan", "count": 7, "spread": 0.06, "damage": 2 }
      ],
      "bomb": { "type": "clear-only", "invulnerabilityMs": 2600 }
    }
  },
  "enemies": {
    "wisp": { "hp": 10, "speed": 76, "radius": 14, "score": 1200, "pickupChance": 0.42, "color": "#70e8ff", "movement": { "type": "linear", "velocityY": 76 }, "patterns": [{ "type": "aimed", "intervalMs": 1300, "bulletSpeed": 160, "count": 1, "waves": 2, "color": "#59dfff" }] },
    "fairy": { "hp": 16, "speed": 68, "radius": 16, "score": 1800, "pickupChance": 0.5, "color": "#ff72c7", "movement": { "type": "linear", "velocityY": 68 }, "patterns": [{ "type": "fan", "intervalMs": 1550, "bulletSpeed": 145, "count": 5, "spread": 0.17, "color": "#ff62bb" }] },
    "sentinel": { "hp": 32, "speed": 54, "radius": 22, "score": 5000, "pickupChance": 0.75, "color": "#ffd063", "movement": { "type": "linear", "velocityY": 54 }, "patterns": [{ "type": "radial", "intervalMs": 1050, "bulletSpeed": 125, "count": 12, "spin": 0.14, "color": "#ffc857" }] }
  },
  "bosses": {
    "selene": {
    "name": "성좌의 파수꾼 셀레네",
    "texture": "boss_battle",
    "radius": 34,
    "tint": "#ffd8ff",
    "spawn": { "x": 320, "y": -90 },
    "movement": { "type": "sine", "centerX": 320, "enterY": 130, "enterSpeed": 95, "amplitudeX": 190, "periodMs": 2400 },
    "phases": [
      {
        "name": "성부 「쌍성의 윤무」",
        "hp": 280,
        "durationMs": 20000,
        "patterns": [
          { "type": "spiral", "intervalMs": 250, "bulletSpeed": 138, "count": 9, "spin": 1.15, "color": "#67dfff" },
          { "type": "aimed", "intervalMs": 1250, "bulletSpeed": 205, "count": 1, "waves": 3, "color": "#fff07a" }
        ]
      },
      {
        "name": "종언 「별이 지는 밤」",
        "hp": 420,
        "durationMs": 26000,
        "patterns": [
          { "type": "spiral", "intervalMs": 190, "bulletSpeed": 155, "count": 11, "spin": 1.55, "color": "#ff5d75" },
          { "type": "rain", "intervalMs": 800, "bulletSpeed": 185, "count": 7, "color": "#77efff" },
          { "type": "aimed", "intervalMs": 1400, "bulletSpeed": 230, "count": 1, "waves": 3, "color": "#fff08a" }
        ]
      }
    ]
    }
  },
  "assets": {
    "hero": "./assets/characters/hero.svg",
    "hero_portrait": "./assets/portraits/hero-painted-v2.png",
    "boss_battle": "./assets/portraits/selene-painted-v1.png",
    "boss_portrait": "./assets/portraits/selene-painted-v1.png",
    "meadow_background": "./assets/maps/meadow-painted-v2.png",
    "ruins_background": "./assets/maps/ruins-painted-v1.png"
  }
}
